{
  "$schema": "https://json-schema.org/draft/2020-12/schema",
  "$id": "skill.schema.json",
  "title": "Skill Registry Entry",
  "type": "object",
  "required": [
    "name",
    "description",
    "provides"
  ],
  "properties": {
    "name": {
      "type": "string",
      "minLength": 1
    },
    "description": {
      "type": "string",
      "minLength": 1
    },
    "version": {
      "type": "string",
      "minLength": 1
    },
    "provides": {
      "type": "array",
      "minItems": 1,
      "items": {
        "type": "string",
        "minLength": 1
      },
      "uniqueItems": true
    },
    "contentPath": {
      "type": "string",
      "minLength": 1,
      "pattern": "^(?!/)(?!.*(?:^|/)\\.\\.(?:/|$)).+"
    },
    "contextBudget": {
      "type": "object"
    },
    "capabilities": {
      "type": "array",
      "items": {
        "type": "string",
        "minLength": 1
      },
      "uniqueItems": true
    },
    "capabilityGroups": {
      "type": "array",
      "items": {
        "type": "object"
      }
    },
    "documents": {
      "type": "array"
    },
    "inputs": {
      "type": "array"
    },
    "outputs": {
      "type": "array"
    },
    "requiresCapabilities": {
      "type": "array",
      "items": {
        "type": "string",
        "minLength": 1
      },
      "uniqueItems": true
    },
    "recommendedAgents": {
      "type": "array",
      "items": {
        "type": "string",
        "minLength": 1
      },
      "uniqueItems": true
    }
  }
}
