{
  "name": "workflow-routing",
  "version": "0.1.0",
  "description": "Use when the Orchestrator must route work through workflow states, gates, failures, and handoffs without bypassing evidence requirements.",
  "provides": [
    "workflow.route",
    "workflow.validate-state",
    "workflow.handoff"
  ],
  "contentPath": "SKILL.md",
  "contextBudget": {
    "maxTokens": 1800
  },
  "requiresCapabilities": [],
  "recommendedAgents": [
    "Orchestrator"
  ]
}
