{
  "name": "code-review-clean-code",
  "version": "0.1.0",
  "description": "Use when reviewing code for readability, naming, structure, duplication, simplicity, and maintainability.",
  "provides": [
    "review.clean-code"
  ],
  "contentPath": "SKILL.md",
  "contextBudget": {
    "maxTokens": 1800
  },
  "requiresCapabilities": [],
  "recommendedAgents": [
    "CodeReviewer"
  ]
}
