{
  "name": "code-review-tests",
  "version": "0.1.0",
  "description": "Use when reviewing test coverage, validation evidence, failure reporting, regression risk, and test reliability.",
  "provides": [
    "review.tests"
  ],
  "contentPath": "SKILL.md",
  "contextBudget": {
    "maxTokens": 1600
  },
  "requiresCapabilities": [],
  "recommendedAgents": [
    "CodeReviewer"
  ]
}
